{
    "name": "Bolster Confidence",
    "journalUuid": "Compendium.pf2e-kingmaker-tools.kingmaker-tools-journals.JournalEntry.uSTTCqRYCWj7a38F.JournalEntryPage.pxHYFLK7VYGppCzS",
    "isLocked": true,
    "isSecret": false,
    "skillRequirements": [],
    "skills": [],
    "effectUuids": [
        {
            "uuid": "Compendium.pf2e-kingmaker-tools.kingmaker-tools-camping-effects.Item.mAEvnTqFuLIASQLB"
        }
    ]
}